{
  "schema_version": "0.1",
  "generator": {
    "tool": "recon",
    "version": "1.0.0",
    "command": "diff"
  },
  "left": {
    "label": "left",
    "project": "sample-debug",
    "project_file": null,
    "binary": "\u003Crepo\u003E/tests/corpus/mingw/sample-debug.exe",
    "sha256": "41b9c2eff66b8a17d007711a8eda78aa31a3684f824b9f26dfb5ded6060df162",
    "format": "pe32",
    "arch": "x86",
    "image_size": 241664,
    "entry_rva": 5104,
    "functions": 142,
    "debug_kind": "dwarf",
    "toolchain": "gcc-14-mingw",
    "analysis_ms": 0,
    "inventory_source": "built"
  },
  "right": {
    "label": "right",
    "project": "sample-release",
    "project_file": null,
    "binary": "\u003Crepo\u003E/tests/corpus/mingw/sample-release.exe",
    "sha256": "84668014ea9bca10617db37a664f31de797d647e2cab3eefd89cd87521b2861c",
    "format": "pe32",
    "arch": "x86",
    "image_size": 241664,
    "entry_rva": 5104,
    "functions": 142,
    "debug_kind": "dwarf",
    "toolchain": "gcc-14-mingw",
    "analysis_ms": 0,
    "inventory_source": "built"
  },
  "model": {
    "relocation_classes": {
      "HIGHLOW": 1007
    },
    "references_named": 1159,
    "references_unnamed": 2373,
    "references_identified": 108,
    "relocation_model": {
      "HIGHLOW": "Absolute"
    },
    "reference_classes": {
      "Absolute": 3355,
      "Import": 282,
      "JumpTable": 3
    },
    "matched_by": {
      "name": 138,
      "body": 1
    },
    "bodies_proven_identical": 127,
    "similarity_threshold": 0.8,
    "ignore_padding": true,
    "difference_limit": 6,
    "profile": null
  },
  "summary": {
    "functions_left": 142,
    "functions_right": 142,
    "matched": 139,
    "exact": 127,
    "changed": 12,
    "folded": 0,
    "only_left": 3,
    "only_right": 3,
    "instructions_left": 8124,
    "instructions_right": 8076,
    "instructions_equal": 7885,
    "score": 0.9706,
    "data_symbols": 1,
    "data_identical": 146,
    "data_changed": 0
  },
  "functions": [
    {
      "status": "changed",
      "match": "name",
      "score": 0.1429,
      "moved": true,
      "left": {
        "id": "f_001559",
        "name": "add",
        "rva": 5465,
        "size": 13,
        "section": ".text",
        "calling_convention": "cdecl",
        "flags": []
      },
      "right": {
        "id": "f_001570",
        "name": "add",
        "rva": 5488,
        "size": 9,
        "section": ".text",
        "calling_convention": "cdecl",
        "flags": []
      },
      "instructions": {
        "left": 7,
        "right": 3,
        "equal": 1,
        "relocated": 0
      },
      "differences": [
        {
          "kind": "opcode",
          "left_rva": 5465,
          "right_rva": 5488,
          "left_text": "push ebp",
          "right_text": "mov eax,[esp\u002B8]",
          "left_reference": null,
          "right_reference": null
        },
        {
          "kind": "opcode",
          "left_rva": 5466,
          "right_rva": 5492,
          "left_text": "mov ebp,esp",
          "right_text": "add eax,[esp\u002B4]",
          "left_reference": null,
          "right_reference": null
        },
        {
          "kind": "removed",
          "left_rva": 5468,
          "right_rva": null,
          "left_text": "mov edx,[ebp\u002B8]",
          "right_text": null,
          "left_reference": null,
          "right_reference": null
        },
        {
          "kind": "removed",
          "left_rva": 5471,
          "right_rva": null,
          "left_text": "mov eax,[ebp\u002B0Ch]",
          "right_text": null,
          "left_reference": null,
          "right_reference": null
        },
        {
          "kind": "removed",
          "left_rva": 5474,
          "right_rva": null,
          "left_text": "add eax,edx",
          "right_text": null,
          "left_reference": null,
          "right_reference": null
        },
        {
          "kind": "removed",
          "left_rva": 5476,
          "right_rva": null,
          "left_text": "pop ebp",
          "right_text": null,
          "left_reference": null,
          "right_reference": null
        }
      ],
      "notes": []
    },
    {
      "status": "changed",
      "match": "name",
      "score": 0.1667,
      "moved": true,
      "left": {
        "id": "f_001566",
        "name": "mul_std",
        "rva": 5478,
        "size": 14,
        "section": ".text",
        "calling_convention": "cdecl",
        "flags": []
      },
      "right": {
        "id": "f_001580",
        "name": "mul_std",
        "rva": 5504,
        "size": 12,
        "section": ".text",
        "calling_convention": "cdecl",
        "flags": []
      },
      "instructions": {
        "left": 6,
        "right": 3,
        "equal": 1,
        "relocated": 0
      },
      "differences": [
        {
          "kind": "opcode",
          "left_rva": 5478,
          "right_rva": 5504,
          "left_text": "push ebp",
          "right_text": "mov eax,[esp\u002B8]",
          "left_reference": null,
          "right_reference": null
        },
        {
          "kind": "opcode",
          "left_rva": 5479,
          "right_rva": 5508,
          "left_text": "mov ebp,esp",
          "right_text": "imul eax,[esp\u002B4]",
          "left_reference": null,
          "right_reference": null
        },
        {
          "kind": "removed",
          "left_rva": 5481,
          "right_rva": null,
          "left_text": "mov eax,[ebp\u002B8]",
          "right_text": null,
          "left_reference": null,
          "right_reference": null
        },
        {
          "kind": "removed",
          "left_rva": 5484,
          "right_rva": null,
          "left_text": "imul eax,[ebp\u002B0Ch]",
          "right_text": null,
          "left_reference": null,
          "right_reference": null
        },
        {
          "kind": "removed",
          "left_rva": 5488,
          "right_rva": null,
          "left_text": "pop ebp",
          "right_text": null,
          "left_reference": null,
          "right_reference": null
        }
      ],
      "notes": []
    },
    {
      "status": "changed",
      "match": "name",
      "score": 0.1111,
      "moved": true,
      "left": {
        "id": "f_001574",
        "name": "sub_fast",
        "rva": 5492,
        "size": 20,
        "section": ".text",
        "calling_convention": "cdecl",
        "flags": []
      },
      "right": {
        "id": "f_001590",
        "name": "sub_fast",
        "rva": 5520,
        "size": 5,
        "section": ".text",
        "calling_convention": "cdecl",
        "flags": []
      },
      "instructions": {
        "left": 9,
        "right": 3,
        "equal": 1,
        "relocated": 0
      },
      "differences": [
        {
          "kind": "opcode",
          "left_rva": 5492,
          "right_rva": 5520,
          "left_text": "push ebp",
          "right_text": "mov eax,ecx",
          "left_reference": null,
          "right_reference": null
        },
        {
          "kind": "opcode",
          "left_rva": 5493,
          "right_rva": 5522,
          "left_text": "mov ebp,esp",
          "right_text": "sub eax,edx",
          "left_reference": null,
          "right_reference": null
        },
        {
          "kind": "removed",
          "left_rva": 5495,
          "right_rva": null,
          "left_text": "sub esp,8",
          "right_text": null,
          "left_reference": null,
          "right_reference": null
        },
        {
          "kind": "removed",
          "left_rva": 5498,
          "right_rva": null,
          "left_text": "mov [ebp-4],ecx",
          "right_text": null,
          "left_reference": null,
          "right_reference": null
        },
        {
          "kind": "removed",
          "left_rva": 5501,
          "right_rva": null,
          "left_text": "mov [ebp-8],edx",
          "right_text": null,
          "left_reference": null,
          "right_reference": null
        },
        {
          "kind": "removed",
          "left_rva": 5504,
          "right_rva": null,
          "left_text": "mov eax,[ebp-4]",
          "right_text": null,
          "left_reference": null,
          "right_reference": null
        }
      ],
      "notes": [
        "2 further differences not listed"
      ]
    },
    {
      "status": "changed",
      "match": "name",
      "score": 0.3651,
      "moved": true,
      "left": {
        "id": "f_001588",
        "name": "dispatch",
        "rva": 5512,
        "size": 267,
        "section": ".text",
        "calling_convention": "cdecl",
        "flags": []
      },
      "right": {
        "id": "f_0015a0",
        "name": "dispatch",
        "rva": 5536,
        "size": 333,
        "section": ".text",
        "calling_convention": "cdecl",
        "flags": [
          "has_jump_table"
        ]
      },
      "instructions": {
        "left": 58,
        "right": 63,
        "equal": 23,
        "relocated": 7
      },
      "differences": [
        {
          "kind": "removed",
          "left_rva": 5512,
          "right_rva": null,
          "left_text": "push ebp",
          "right_text": null,
          "left_reference": null,
          "right_reference": null
        },
        {
          "kind": "removed",
          "left_rva": 5513,
          "right_rva": null,
          "left_text": "mov ebp,esp",
          "right_text": null,
          "left_reference": null,
          "right_reference": null
        },
        {
          "kind": "opcode",
          "left_rva": 5518,
          "right_rva": 5539,
          "left_text": "cmp dword ptr [ebp\u002B8],0Ah",
          "right_text": "mov eax,[esp\u002B0Ch]",
          "left_reference": null,
          "right_reference": null
        },
        {
          "kind": "opcode",
          "left_rva": 5522,
          "right_rva": 5543,
          "left_text": "ja near ptr .fn\u002B0x104",
          "right_text": "cmp eax,0Ah",